{
  "version": 1,
  "company_source": {
    "enrichment_run_id": "enrichment-run-2",
    "bucket": "ready",
    "domains": ["fpcdoctors.com"]
  },
  "roles": [
    {
      "key": "operations_manager",
      "labels": [
        "operations manager",
        "operations director",
        "chief operating officer",
        "COO"
      ],
      "max_per_company": 1
    }
  ],
  "company_limit": null,
  "contact_limit": null,
  "current_only": true,
  "require_role_match": true,
  "memory_freshness_days": 30
}
