{
  "version": 1,
  "company_source": {
    "enrichment_run_id": "company-enrich-f10a41712cbb",
    "bucket": "all",
    "domains": ["patriumhealth.com"]
  },
  "roles": [
    {
      "key": "founder_ceo",
      "labels": ["founder", "co-founder", "ceo", "chief executive officer"],
      "max_per_company": 1
    },
    {
      "key": "practice_manager",
      "labels": ["practice manager", "clinic manager"],
      "max_per_company": 1
    },
    {
      "key": "office_manager",
      "labels": ["office manager", "operations manager", "operations director"],
      "max_per_company": 1
    }
  ],
  "company_limit": null,
  "contact_limit": null,
  "current_only": true,
  "require_role_match": true,
  "memory_freshness_days": 30
}
