{
  "version": 1,
  "company_source": {
    "enrichment_run_id": "company-enrich-a1b2c3d4e5f6",
    "bucket": "ready",
    "domains": []
  },
  "roles": [
    {
      "key": "project_manager",
      "labels": ["project manager", "senior project manager"],
      "max_per_company": 1
    },
    {
      "key": "estimator",
      "labels": ["estimator", "senior estimator", "chief estimator"],
      "max_per_company": 1
    }
  ],
  "company_limit": null,
  "contact_limit": null,
  "current_only": true,
  "require_role_match": true,
  "memory_freshness_days": 30
}
